slug,title,summary,category,published_at,source_url
pocso-brief,Understanding the POCSO Act in 2025,Updates to state-level guidelines and how Shield 360 aligns with the latest mandates.,Legal Brief,2025-02-01,https://www.example.com/articles/pocso-brief
community-playbook,Community Playbook for Safer Schools,Insights from recent workshops with NGOs and school administrators in Bengaluru.,Community,2025-01-18,https://www.example.com/articles/community-playbook
ai-chatbot,AI-Assisted Crisis Detection: Early Findings,How our chatbot pilot is identifying early warning signals and routing help faster.,Product,2025-01-05,https://www.example.com/articles/ai-chatbot
safety-tips,10 Essential Safety Tips for Children,Important safety guidelines every parent should teach their children.,Education,2025-01-20,https://www.example.com/articles/safety-tips
reporting-guide,How to Report Child Abuse: A Step-by-Step Guide,A comprehensive guide on reporting procedures and legal requirements.,Legal Brief,2025-01-15,https://www.example.com/articles/reporting-guide

